{
  "schema_version": 1,
  "product": "CW",
  "cw_version": "0.13.0",
  "recording_kind": "real-workflow-recording",
  "goal": "Add a deterministic greeting function with automated tests in one development phase using Python 3",
  "brand": {
    "name": "CW",
    "product_name": "Codex Workflow",
    "maker": "Queopius"
  },
  "provenance": {
    "recorded_from_real_workflow": true,
    "source_commit": "57dfa15431bd6b43ae89e03efeac9747dfcc3e35"
  },
  "events": [
    {
      "type": "command",
      "text": "cw init",
      "command": "cw init"
    },
    {
      "type": "success",
      "text": "Project initialized"
    },
    {
      "type": "command",
      "text": "cw plan --goal \"Add a deterministic greeting function with automated tests in one development phase using Python 3\"",
      "command": "cw plan --goal \"Add a deterministic greeting function with automated tests in one development phase using Python 3\""
    },
    {
      "type": "success",
      "text": "Plan proposed"
    },
    {
      "type": "command",
      "text": "cw plan show",
      "command": "cw plan show"
    },
    {
      "type": "phase",
      "text": "01-implement-greeting · Implement and test deterministic greeting"
    },
    {
      "type": "command",
      "text": "cw plan approve",
      "command": "cw plan approve"
    },
    {
      "type": "success",
      "text": "Plan approved"
    },
    {
      "type": "command",
      "text": "cw start",
      "command": "cw start"
    },
    {
      "type": "success",
      "text": "Codex process started"
    },
    {
      "type": "success",
      "text": "Codex session initialized"
    },
    {
      "type": "active",
      "text": "Implementation active"
    },
    {
      "type": "info",
      "text": "Project files updated · 2 changes"
    },
    {
      "type": "info",
      "text": "Project files updated · 1 change"
    },
    {
      "type": "command",
      "text": "cw review",
      "command": "cw review"
    },
    {
      "type": "active",
      "text": "Running python3 -m unittest discover -v",
      "command": "python3 -m unittest discover -v"
    },
    {
      "type": "success",
      "text": "python3 -m unittest discover -v completed",
      "command": "python3 -m unittest discover -v"
    },
    {
      "type": "validation",
      "text": "Deterministic validation passed",
      "result": "passed"
    },
    {
      "type": "review",
      "text": "Independent review approved",
      "result": "APPROVE"
    },
    {
      "type": "gate",
      "text": "Approval gate verified",
      "result": "verified"
    },
    {
      "type": "review",
      "text": "Completion review satisfied",
      "result": "SATISFIED"
    },
    {
      "type": "complete",
      "text": "Completion target satisfied"
    }
  ],
  "final_result": {
    "workflow_status": "COMPLETED",
    "approved_phases": 1,
    "valid_gates": 1
  }
}
